Rate,Phrase
3.0,"Realmente ha sido muy difícil configurarlo. Tengo otros artículos comprados en Amazon que he podido integrar muy fácilmente a mi red y a Alexa, pero este foco fue muy difícil que detectara la red y luego ponerlo a funcionar tanto con su propia aplicación y luego con..."
3.0,
3.0,"El enlace con Alexa falla, hay que usar el interruptor manual para recuperar la conexión. A su favor tiene excelente iluminación y variedad de colores"
3.0,Funciona bien pero de vez en cuando se necesita apagar y prender directamente del contacto energía eléctrica para que vuelva a sincronizarse
3.0,"Tuve que conectarlo en la misma habitación donde está el módem de Telmex, ya que al cuarto de a un lado ya no reacciona bien incluso paroadeaba de manera irregular. Tuve que regresarlos, pedí unos kasa de TP-LINK y sin Problemas hasta ahora y algunos los conecte a más de 10..."
3.0,
3.0,"El brillo es muy bueno, la aplicación es amigable, después de instalar la skill de Alexa detecta sin problema el dispositivo, pero la forma de activar el emparejamiento está como mal pensada, ya que se activa prendiendo y apagando el interruptor un par de veces, y eso es..."
2.0,"De 4 focos que compré 3 ya se fundieron de la nada, duraron menos de un año y además la calidad de la luz no es tan buena, derrepente la intensidad de la luz era variable como si tuviera problemas de voltaje"
2.0,"Funciona bien en la aplicacion pero con alexa se drsvincula siempre, no tiene buena recepicion de wifi"
2.0,"Se batalla con la app que sugiere, funciona con otra mejor, por eso mi calificación, el producto bien"
2.0,"Es buen producto pero siempre se desconfigura sólo, o dice que no hay red o cosas así..."
2.0,"En un principio nos encantó. Hasta que quisimos ponerlo en la puerta de la entrada y continuamente se desconfiguraba, haciendo que nos quedáramos sin luz afuera y dificultando algo tan simple como buscar las llaves para entrar. Terminamos cambiándolo por un foco con sensor..."
2.0,
2.0,"Si se va seguido la luz o el internet en tu casa no lo recomiendo, con la mínima falla se desenlaza el dispositivo y tienes que volverlo a conectar, y lo malo en eso es que ni siquiera funciona bien porque hasta eso falla constantemente dando errores en la conexión del..."
2.0,
2.0,Sin duda funciona bien al princio pero resultó que se fundio muy rapido. Recomiendo mejorar la calidad de los circuitos.
2.0,Se desconfigura mucho
2.0,"La luz blanca se ve verdosa, muy mal."
2.0,"I have 3 bulbs. One keeps failing quite often and I have to do the whole routine of adding it on the app again and again unless I keep the switch light on. The second one fails int the same way, but just once in a while. And the first one is perfect. I..."
2.0,
2.0,A los 3 meses dejo de cambiar los colores y solo sirve luz blanca y fría y al hacer el reclamo dicen que ya nonemtra en garantía...
2.0,"Tengo 2 focos de este tipo, batallo bastante para hacerlos funcionar con app de la marca, si se va la luz o el internet casi que tienes que volver a enlazar el foco como la primera vez y de la compatibilidad con Alexa mejor ni hablamos es una decepción"
2.0,"No duró ni dos meses, ya no prendió, al principio muy bien, pero menos de dos meses después, dejó de funcionar."
2.0,"no se me hace mal foco del todo, pero sí tiene muchos problemas Si se va el internet poder usar el interruptor de luz manual es un caos porque no prende como si lo llegan a hacer otros focos cuando apagas y prendes el apagador Para configurarlo la primera..."
2.0,
2.0,"Es un buen foco pero es molesto que cada q se va la luz o hay un apagón los tienes que estar configurando, y aveces q se desconfiguran solos, o aveces no se reconocen en la red tampoco Alexa los reconoce, la vdd recomiendo compren otro"
2.0,No me gusto que es diferente el tono o la intensidad del foco a los que he comprado anteriormente
2.0,"Fue algo complicado ( 3 veces apague) ya que necesitas tener muy sercas el módem de el foco para poder hacer la instalación , es complicado elegir tipo de luz con este foco , veremos más adelante que tal se comporta"
2.0,"Fue buen producto pero al pasar del tiempo no, por que me preguntaran yo había comprado 1 al principio para mi ventilador, funcionaba bien pero cambie de ventilador por uno de 2 focos y tuve que comprar el otro lo malo fue que el primer foco que compre cuando lo cambie si..."
2.0,
2.0,"Esta lampara tiene una pésima vinculación con el internet, tienes que hacer el proceso varias veces hasta que no te salga un error, ademas, el 90% de las veces que quiero apagar la maldita luz no detecta la señal, por lo tanto me jodo y me toca aguantarme hasta 30 min..."
2.0,
2.0,"Yo tengo varios focos en cada habitación, pero cada habitación sólo tiene un interruptor. De esta manera es básicamente imposible conectar fácilmente todos los dispositivos (en este caso, focos) de cada habitación. Los recomiendo un 3 de 10. Lo barato sale caro."
2.0,"Mi experiencia después de casi un año: Al inicio fué fácil la instalación (es un foco) aunque el agregarlo a la aplicación deja algunas cosas que desear (no se por qué necesito crear una cuenta a fuerza, entregar mis datos para poder encender o apagar una luz no me suena..."
2.0,
2.0,"Constantemente se pierde la conexión y dejan de responder, lo cual me obliga a controlarlos con el interruptor manual, situación que no me sucede con otros dispositivos inteligentes. Es un problema muy tedioso."
2.0,"Se puede instalar después de varios intentos y se le pueden programar fácilmente rutinas para su encendido o apagado, el problema se presenta cuando uno no se encuentra al alcance de la conexión vía Bluetooth hacia el foco con un dispositivo móvil, ya que para controlarlo..."
2.0,
2.0,"no me gusto, aunque fue un combo la compra en la que el foco salio con casi 70% de descuento, es inutil, de nada sirve tener un foco que por si solo no alumbra lo suficiente un cuarto, el gancho es comprar 2 y que estos hagan un trabajo correcto, la configuracion de la app..."
2.0,
2.0,"Al inicio fue un dolor de cabeza vincularlo pero al final lo logré y todo estaba de maravilla. Solo funcionó un mes y jamás pude volver a vincularlo ni si quiera lo encuentra la app del fabricante, ahora solo es un foco común y corriente."
2.0,"Tiene buena iluminación y diversos modos de luz pero sólo dentro de su aplicación, es muy difícil vincular la cuenta de su app a Alexa y una vez vinculada NO reconoce el foco por lo que solo funciona mediante su aplicación."
2.0,"En blanco funciona bien, pero en RGB ilumina muy poco."
2.0,Algo no está bien en el software
2.0,"Vengo después de 3 meses de darle uso a este foco, la verdad es que en general cumple todas sus funciones, ilumina bien, variedad de colores, etcétera. Pero no entiendo cómo es que tiene tan buena calificación, es increíble la pésima conexión que tiene, yo lo uso..."
2.0,
2.0,"No lo compren, no se puede conectar con Alexa, pésima marca, ilumina bien pero de nada sirve si lo quieres para usarlo con Alexa, tienes que prenderlo y apagarlo con el teléfono y la aplicación tarda en cargar"
2.0,"El producto como tal está bien, lo que me decepcionó fue que no se puede conectar con Alexa y principalmente lo compre para eso"
2.0,"La app se carga fácilmente, Activar la skill de alexa es de lo mas sencillo, la vinculación inicial si eres familiar con alexa no tiene mayores complicaciones, verifique la variación de colores y la intensidad con cada color, todo parece perfecto, ..... PEEEEEERO, al..."
2.0,
2.0,No se conecto con mi Alexa y a veces se prende y se apaga la luz.
2.0,Un mal funcionamiento de los focos tuve que pedir un cambio por que un foco no prendía bien y al recibir el remplazo a los 3 meses pierde la conexión diario No recomendable
2.0,"Siempre se prende solo, nunca se conecta con Alexa por lo que tendrás que manejarlo por siempre con su aplicación y si tienes suerte de que no se desconecte del wifi podrás volver a usarlo normalmente por que se des configura cada día"
2.0,"Si vas a hacer un gasto para integrar focos inteligentes que sean para crear escenas o quieres darle un toque diferente a tus habitaciones, definitivamente no recomiendo estos focos, el brillo de cualquiera de los colores no es suficiente para iluminación, es una simple..."
2.0,
2.0,A la hora de comprarlo no me percaté de los watts de foco y no alumbra tanto como yo pensaba
2.0,"El foco funciona muy bien, pero fue imposible sincronizarlo con Alexa"
2.0,"Fue muy complicada la configuracion, no viene un manual de config por lo que intente con diferentes App (Lloyds, Tuya, Smart Life, esta ultima fue la que me funciono finalmente) pero al integrarla con Alexa se desconecta y desconfigura a cada rat y pierdes mucho tiempo en..."
2.0,
2.0,"La configuración me tomó varios intentos y casi 30 minutos, ya que no sincronizaba con la Aplicación. Si apagas el foco manualmente tiende a desprogramarse. Por lo que tiene que ser con la aplicación, lo cual resulta un fastidio. Solo una persona puede controlar los..."
2.0,
2.0,"Es un producto muy padre, me funcionaron perfectamente los primeros meses y después de medio año dejo de funcionar la variación de colores RGB, intenté ponerme en contacto con el fabricante y no se quisieron hacer responsables, no cumplieron con el tiempo de funcionamiento..."
2.0,
2.0,"Honestamente no me termina de agradar, la iluminación de colores es muy baja o tenue ni siquiera de noche logra iluminar un cuarto chico además que simplemente se desconecta y hasta la fecha no se cómo hacerlo que se reconectar pues no sirve de nada apagar y prender el..."
2.0,
2.0,Lo he intentado muchas veces y no logro que se vincule con Alexa :(
2.0,"Son exclentes focos en cuento a iluminación y variedad de colores que tiene, pero se desvinculan o se desconectan muy frecuente. Hay que reiniciarlos manualmente para que vuelvan a conectarse y respondan correctamente."
2.0,Se programo y emparejó bien y después de 6 meses se desprogramo y ya no se pudo volver a programar ni emparejar.
2.0,"Le doy 2 estrellas porque creo me toco un producto con falla. Es fácil de instalar y vincular con alexa, la intensidad de la luz es buenísima, al inicio respondía muy bien, pero después empezó a parpadear en lapsos de 20 a 30 segundos, investigué y todo apuntaba a que..."
2.0,
2.0,No se empareja al wifi y no se agrega el dispositivo a la app de lloydsmart
2.0,"Después de 8 meses dejó de funcionar. comparado con otros 5 de otra marca que tengo y que llevan 2 años sin problemas, este duró muy poco y me costarón más caros"
2.0,"Alumbra bien, pero constantemente se desprograma"
2.0,"1era compra:Buena compatibilidad, brillo ok, al año 4 meses dejaron de funcionar los colores, ahora solo funciona la luz normal en luz fría o calida. 2da compra:A los 3 meses se desconfigura a cada rato y en muchas ocasiones no responde al echo dot."
2.0,"Los instalé en un punto no tan lejos del modem y siempre se terminan desconectando hasta el punto de desconfigurarse. Me compré unos de steren, con la mismas características de instalación y sí llega sin temas."
2.0,"Lo instale y me duro dos horas y dejo de conectarse con Alexa ya la aplicación, NOOOO lo compre ahorren para uno de mejor calidad"
2.0,"Funcionó bien los primeros días, pero ahora cada tercer día deja de responder a los comandos desde la aplicación o desde Alexa, ya esta ultima vez ni apagando y encendiendo el foco responde, si ilumina, pero sin las funciones inteligentes es solo un foco led normal y muy..."
2.0,
2.0,"hemos tenido sin fin de problemas, cuando lo configuras todo bien pero pierde conexión cada 2 días y tienes que borrarlo y volver a configurar.  Por 100 pesos si lo compré pero por los 300 o 400 pesos que está normalmente ni loco lo compro"
2.0,"Es un foco muy bueno para controlarlo de forma básica, las luces blancas funcionan bien, los temporizadores también y en general funcionan decente. Lo malo es que estos focos son vendidos como leds que cambian de color. Si..."
2.0,
2.0,"Hice la compra hace 1 año y medio pero ya no funciona el wifi solamente el foco lo cual me dice la calidad del producto que no dura nada, dudo mucho que todavía tenga garantía :("
2.0,"No dudo de la calidad del producto, solo venía con un falso y se desconectaba muy, muy seguido."
2.0,Después de un tiempo prendido parpadea mucho y a veces no enciende
2.0,"La gama de luces y la intensidad de las luces blanca y cálida son excelentes, pero se descanecta a cada rato del wifi, llego a mi casa y es imposible encenderlo por comando de voz, tienes que apagarlo y prenderlo de nuevo y a veces hasta volver a dar de alta el dispositivo..."
2.0,
2.0,"El foco en si se ve bueno, aunque no brilla mucho en el modo de color. Lo malo es que te obliga a bajar la aplicación para usarlo, y cuando creas tu cuenta y le asignas un password, al momento de querer activarlo en Alexa, te aparece que la information es incorrecta. Tengo..."
2.0,
2.0,Muy mala experiencia
2.0,"Tiene buenos colores y funciones pero no ilumina lo suficiente para alumbrar una habitación cuando usas la gama de colores, cuando usas luz fría o cálida si, pero para eso compras otro producto.... este es caro y no me satisfizo."
2.0,Solo funcionó dos días
2.0,"Después de unos días se desconecto de Alexa y en la aplicación me aparece como fuera de línea, ya lo intenté reiniciar y revisar la red, en la aplicación no me permite subir fotos para poder enviar el problema. Ahora solo funciona como un foco normal y como deje la luz..."
2.0,
2.0,"Después de 45 días el foco aparece desconectado, ya intente conectarlo/restablecerlo y después de dos días no se ha resuelto, pasa a ser un simple foco caro"
2.0,Que de repente se apago y ya de ahí ya no volvió a funcionar. Tan caro y con estos problemas
2.0,"Demasiado baja la Luz, Muy poca"
2.0,"Pensé que podía apagarlo a larga distancia y no se puede, solo si estás cerca funciona"
2.0,"Al principio esta bien y aunque cuesta instalarlo funciona mas o menso bien con alexa, el problema es que a menos de dos meses de uso ya no sirven"
2.0,"Es un foco que es fácil de instalar, el brillo no es muy bueno y a menudo tiene parpadeos."
2.0,"Ya intenté agregarlo.co. Alexa con llolds y con Tuya Smart con o sin skills, lo agrega a Alexa pero siempre muestra mensaje de ""El dispositivo no responde"". Con las apps de llolds y de tuya se integra sin problema"
2.0,"Los colores no son tan intensos, por el contrario, las luces blanca y cálida sí. Me funcionaba bastante bien, pero al cabo de 4-5 meses de uso comenzó a apagarse espontáneamente y prendía cuando quería, tuve que cambiar de marca y ahora que puedo comprar con otra app me doy..."
2.0,
2.0,"Antes de un año de vida, han dejado de funcionar los leds de color en 3 focos que compre de la misma marca, poco a poco dejaron de prender en color. Decepcionado, por el precio hubiera comprado blancos...la luz blanca funciona bien aún"
2.0,"La calidad de los colores es buena, sin embargo dos de los focos me fallan y ya no reciben comandos de Alexa y uno mas no da el tono amarillo ni el morado. Otro problema es que sí hay apagones no se les puede definir un estado y al momento de encender nuevamente quedan..."
2.0,
2.0,"la primera vez si conecto (despues de demasiados intentos y una configuracion muy dificil) funcionaba bien colores destellos y el enlace con alexa, al querer moverlo del lugar ya no volvio a conectar con alexa ni con la aplicacion que tienes que descargar aparte...."
2.0,
1.0,No adjuntare fotografías ya que no sirven de nada para representar los problemas que tuve. Compre este foco puramente por seguridad para que a una cierta hora se encienda en mi casa ya que en ocasiones no hay nadie y para que mi mascota pueda ver algo y no me...
1.0,
1.0,"Se necesita la app para poder configurar , pero la aplicación es inservible, al tratar de abrirla me saca y no abre... me aparece un mensaje que dice que espere al desarrollador para liberar una nueva versión y arreglar el problema (y mientras me quedo con los focos a..."
1.0,
1.0,"Este es el segundo foco que ni prende, tengo otro y por eso me anime a comprar otro y tener todo mi cuarto ya con este tipos de focos y nada más ni prende ni una pequeña luz da, me dicen que vuleva a hacer la devolcion pero ya van 2 focos ¿Voy a estar devolviendo hasta que..."
1.0,
1.0,"Tengo actualmente focos de Phillips hue, Wiz, LIFX, y sengled, de todos he de decir que los mejores some han parecido los phillis... sin embargo necesitas de un bridge (accesorio extra que se conecta directo al módem) y son muy costosos, yo los conseguí a muy buen precio en..."
1.0,
1.0,"Lamentablemente después de unos meses de uso son malos, se desconectan de tu red y es un calvario volver a configurar, y aún así solo un or de horas y vuelven a fallar, en lo personal yo no vuelvo a adquirir esta marca en focos inteligentes. Uno de mis focos de plano ya no..."
1.0,
1.0,"Nunca logré en todo un mes, el foco se sincronizara con la aplicación por tema del wifi... Asi que al final lo deje de adorno en casa por pasarse el tiempo de devolución. Ademas me parece una ridicules de que siempre este papadeando al encenderlo solo..."
1.0,
1.0,"Llego bien el paquete, el problema es al momento de querer enlazarlo en la app de LloydsSmart ya que se cierra continuamente y no me deja agregar el dispositivo, mientras ese error perdure, no los recomiendo."
1.0,"El producto solo se usó dos noches y en la segunda noche dejó de funcionar, no enciende ni se conecta al wifi, he comprado productos chinos que duran más. No lo recomiendo en absoluto."
1.0,"No vale la pena comprar el foco segui las instrucciones e hice todo lo posible y nunca sirvió, es un foco más en casa es una pena"
1.0,Compré dos bocinas y dos focos y los dos focos no encendieron al conectarlos a la corriente. (calificación sujeta a la devolución y remplazo de mis productos)
1.0,Lo conecte sin problema sin embargo a los dos días se apagó y dejo de funcionar intento llamar para garantía del producto y nadie contesta.
1.0,"Tengo focos de la competencia, de Feit, esos tienen cerca de dos años puestos y programados. Los he tenido que revisar con la app solamente para cambiar los horarios de prendido y apagado un par de veces al año. Este venia como parte de una promoción en la compra de..."
1.0,
1.0,"No funciono el foco , aparte de que tienes que bajar una app para posiblemente hacerlo funcionar , no lo recomiendo para alexa"
1.0,"Es una porquería con letras mayúsculas, de verdad no importa cuantas veces intentes configurarlo en la aplicación, jamás funciona, eso debería considerarse estafa"
1.0,"El producto en sí es bueno pero la aplicación de la marca es malisima, lo cual hace que no puedas usar el producto."
1.0,Llevo 3 semanas con el foco y la app no sirve para agregar el foco por lo que no puedo vincular con Alexa
1.0,"Es difícil la instalación y exige una velocidad menor de la que tengo de Internet, así que es inservible para mi."
1.0,Van dos veces que solicito los focos y llegan fundidos ya es la tercera ves que solicito una devolucion
1.0,"Lo intenté más de 5 veces, seguí los pasos al pie de la letra y jamás detectó el dispositivo."
1.0,"Segui las instrucciones al pie de la letra y nada que funciona, me quede con un foco bien caro."
1.0,"Este producto fue bueno, mientras duro. La intensidad de la luz blanca tanto cálida como fría es muy buena siendo capaz de iluminar habitaciones medianas o grandes satisfactoriamente pero la de cualquier otro color que no sea blanco es pésima, apenas se logra ver y por..."
1.0,
1.0,Compre dos focos y los dos no encendieron al conectarlos a la corriente (calificación sujeta a la devolución y remplazo de mis productos)
1.0,No encendió en ningún momento. Se siguieron las instrucciones al pie de la letra.
1.0,Mal servicio de entrega. No estuve para recibir mi envío y la entrega será un mes después. Así no se vale.
1.0,Al momento de abrir la caja con los articulos este llego abierto de su caja y roto de la base!
1.0,"El foco dejó de funcionar a los 40 días de su compra. Era complicado enlazar con la aplicación en un inicio. El brillo y los colores son buenos, pero si solo va a durar poco más de un mes no lo vale."
1.0,A cada rato se desconfigura del eco show muy mal producto
1.0,"El foco no funcionó nunca y ni siquiera lo puedo usar como foco normal, porque no deja de parparear😑"
1.0,No se puede vincular para alexa porque la app no funciona
1.0,Mi producto llegó dañado pedí dos focos y uno está mal
1.0,"Al día se desconecta hasta 10 o más veces, es un lío volverlo a sincronizar, la app falla también bastante, el foco esta a 1m de distancia de mi modem y aún así se desconfigura todos los días, a cada rato, es un asco de producto, de pésima calidad, no lo recomiendo para..."
1.0,
1.0,No nos sirve porqué tampoco nos agrado la bocina
1.0,"producto defectuoso , no sirven , llegan fundidos"
1.0,"Decepcionada, este foco no me deja vincular a la aplicación que usa. Muy tedioso"
1.0,"No se configura, la app de la marca muy mala, no funciona, pésima compra"
1.0,"El foco no funcionó, no encendió jamas"
1.0,"Compré este foco porque tenía uno muy viejo que no estaba ya funcionando. Esta marca no funcionó, nunca logró agregar el foco en la app.  Muy chafa. No recomiendo."
1.0,"Conecta a la app, conecta a travez de la app a alexa, los prende y lo apaga. Después ni prende ni apaga. Tengo otro de la marca evo… estan en el mismo cuarto los dos mismo internet… y este es el unico que no prende… Horrible producto. En la foto el prendido es el de la otra..."
1.0,
1.0,Tiene que estar muy cerca de el modem para que funcione
1.0,"Venía de regalo con mi Echo y ni así lo pude controlar. Se la pasó diciendo ""Nueva Luz no responde"". Me lo reemplazaron y resultó lo mismo, ninguna de mis 3 alexas logró controlarlo. Marca de buen renombre pero modelo muy defectuoso."
1.0,"Más de media hora intentando hacer que agarre, ya conecte el cel la tableta y voy por el 3 celular para ver si lo puedo configurar y nada , prefiero los tp link es más fácil"
1.0,No venía el foco
1.0,"Este foco lo compré a fines de febrero de este año y resulta que ayer 23 de Mayo dejó de funcionar, no hubo ningún pretexto de lluvia, rayos o descarga eléctrica, simplemente como los focos incandecentes, al parecer se fundió y ya no prendió 😏 me duró el gusto 2 meses y..."
1.0,
1.0,"La App no funciona, se cierra y no permite vincularlo"
1.0,No me funciono
1.0,Mal es una mentira
1.0,No me deja concretarlo a mi teléfono porque mi wifi es 5g y no es compatible
1.0,Luego de 1 mes y con poco uso ya que lo tengo en un cuarto con poco movimiento el foco dejó de conectar con el celular o asistente de voz
1.0,"No llego el foco, fue mentira"
1.0,No se conecta rápidamente al wifi
1.0,"1, compre uno que venia con echo dot, funcionaba bien todo, excepto que no se podia configurar para que cuando se fuera la energía electrica, recordara su último estado. 2. Lloyd me hizo valida la garantía y me envió otro sin costo, ahí me di cuenta que el primero..."
1.0,
1.0,"Una lastima duro menos de 1 año (lo compre en Julio 2022 junto a la Alexa ) y dejo de prender, aparece conectado en Alexa pero ya no prende, como para no volver a comprar esta marca."
1.0,Es un fastidio su aplicación y tener que conectar casi siempre. Lo uso para controlarlo desde alexa pero normalmente me dice que no hay conexión o simplemente no enciende cuando lo haces desde la app o desde alexa. Realmente enciende cuando quiere
1.0,Jamás se pudo conectar a mi red wifi aún siendo 2.4 (con la que es compatible)
1.0,"Me duró súper poquito tiempo, no lo recomiendo"
1.0,"Pésimo producto, no fue posible configurarlo con Alex, no lo reconocía, hasta vi videos donde daban paso a paso como hacer la configuración pero no se pudo configurar, no lo compren"
1.0,"El foco empezó muy bien durante un par de semanas. Las opciones de iluminación son amplias y ayuda mucho a establecer un ""mood"" en una habitación. No obstante, el foco se desprograma dos o tres veces a la semana y es tardado volver a programarlo. Se ha vuelto una..."
1.0,
1.0,"Tengo un iPhone 12 y al inicio fue medio fácil instalarlo. Pero una vez que es instalado, ya que no es compatible con HomeKit, necesitas acceder a la app para poder monitorearlo y cambiar la luz. Aquí es donde surgió el problema. La app es bastante lenta al reconocer el..."
1.0,
1.0,No tiene ni un año que lo compre y ya no sirve
1.0,"Mejor lo quite, la app no lo leía, se desconfiguraba a cada rato, no lo pude programar con mi Alexa, luego lo encendía manualmente y se la pasaba parpadeando, abría la app para manipularlo, y lo leía cada que se le antojaba 😅 en fin, está marca no me gusto !"
1.0,"Anteriormente ya había comprado uno y funcionó sin problemas, este nunca prendió, ni siguiendo el manual ni nada, viene defectuoso de fábrica, por desgracia no lo trata de usar antes ya que ni lo ocupaba, solo lo encargué por la promoción, hoy que lo intento prender de..."
1.0,
1.0,"Al principio todo de maravilla, pero al 3/4 mes de uso, el foco empezaba a tener un ligero parpadeo. Al principio pensé que se trataba de un fallo en mi instalación eléctrica, pero después de probar otros focos, pude detectar que el verdadero problema era este foco."
1.0,"En el mes de mayo y junio compré 2 bombillas inteligentes Lloyds en la página de Amazon, estuvieron funcionando perfectamente pero hace una semana al llegar a casa encontré una de ellas parpadeando pero como en ese momento no..."
1.0,
1.0,"En mi caso el foco no funcionó, no prendió , el producto venía defectuoso de fábrica."
1.0,"Pésima compra, compré dos y ambos se desconectan constantemente del WiFi, y para agregarlos es un gran problema también. No los recomiendo."
