Rate,Phrase
5.0,"Me encanta, esta hermoso y se ve increíble en mi colección."
5.0,Esta muy lindo
5.0,"Esta super cool. llego bien su caja sin estar maltratada, esta super genial para la coleccion de mis hijas"
5.0,Habla en inglés y francés. Está muy lindo y el movimiento de ojos funciona súper bien.
5.0,Esta genial me encanto
5.0,"Lo ame, llegó mi dobby rápido y en perfectas condiciones."
5.0,"Hice el pedido y dije que llegaba después de Navidad, llegó 3 días antes de que estuviera feliz, por favor, en una sola pieza como se describe, me encanta este chico, gracias por la rapidez del envío."
5.0,Me encantó ver a mi bisnieta abrir esta prensa. ¡Se puede decir con seguridad que le encantó!
5.0,
5.0,Voz muy linda y clara. Lo tengo de regalo y sé que les encantará.
5.0,Me impresionó mucho lo realista que se ve este Dobby. El costo fue excelente y se envió rápidamente.
5.0,¡Gran Doby que habla inglés y francés!
5.0,¡Un gran juguete que todos adoran!
5.0,Mi hija acaba de entrar en Harry Potter y le encanta esto
5.0,Me encanta porque soy un gran fan de Harry Potter. Soy bb pero me encanta.
5.0,"Es muy lindo, a mi sobrino le encantará"
5.0,"Un personaje pequeño muy lindo. Comprado como regalo para mi nieta, estoy seguro de que estará feliz con este lindo chiquillo. Es una fanática loca de Harry Potter."
5.0,"Compra para mi hermana fanática de ⚯ y está encantada de que podamos elegir entre inglés y francés, es genial."
5.0,¡Doby es muuuy lindo! Tiene un interruptor para hablar en otros idiomas y esta es una gran característica. Es lindo y está bien hecho. Me encanta verlo parpadear y decir sus frases famosas.
5.0,¡A mi nieta le encantó esto! Es precioso.
5.0,Es un regalo. Todavía no estoy seguro de qué tan bien funciona. 5 estrellas por lo adorable que es.
5.0,¡Coherente con la descripción! ¡Genial!
5.0,"Estoy muy contento con Magical Dobby Elf Doll with Sock,"
5.0,"Compré a Hedwig la Navidad pasada, ha tenido mucho amor este año. Cuando vi a Dobby, supe que también quería atraparlo. Estoy muy impresionado con la calidad de estos dos juguetes. ¡No dudaré en comprar más!"
5.0,"¡Esto es tan adorable! Es un regalo de Navidad para mi nieta, así que todavía no puedo proporcionarles un vídeo. Estoy seguro de que le encantará."
5.0,Como la vida
5.0,¡Es genial! ¡Increíble experiencia de compra!
5.0,"Vale la pena cada centavo, ¡esto es absolutamente adorable!"
5.0,¡Me encanta esto! Vale la pena el precio.
5.0,Perfecto para Navidad
5.0,"Se ven bien, pero son para Navidad, así que no están abiertos"
5.0,Nos gustó la calidad y el aspecto de este producto. También era la opción más barata de comprar a través de Amazon.
5.0,"Gran juguete, pero se repite en francés, cosa que no esperaba"
5.0,"¡Mi hija quedó absolutamente encantada cuando lo recibió! La atención a los detalles es impresionante; la muñeca mide 21,6 cm de altura y se parece al querido Dobby de las películas de Harry Potter.  La muñeca está repleta de características, con más de 30 sonidos y frases que dan vida al personaje. Incluso viene con un calcetín para que Dobby lo sostenga, lo cual es un toque agradable. La muñeca se activa por movimiento y responderá a las acciones de tu hija con una variedad de frases y sonidos.  A mi hija le encanta jugar con su nuevo muñeco Dobby y lleva horas haciéndolo realizar diferentes tareas. Se ha convertido rápidamente en su juguete favorito, y le encanta hablar con él y hacer que haga tonterías. La muñeca está bien construida y es duradera, así que estoy seguro de que durará mucho tiempo."
5.0,"Mi hijo es un gran fan de Harry Potter y se emocionó mucho cuando recibió este muñeco Dobby por su cumpleaños. Ha estado jugando con él sin parar desde entonces.  La muñeca está muy bien hecha y tiene un aspecto muy realista. Tiene más de 30 sonidos y frases diferentes, lo que hace que sea muy interactivo y divertido jugar con él. A mi hijo le encanta que Dobby hable con él y responda a sus órdenes.  La muñeca también viene con un calcetín, que es un complemento muy bonito y cuidado. A mi hijo le encanta ponerle un calcetín a Dobby y fingir que lo está liberando."
5.0,"¡Esto es genial! Me encanta. Somos grandes fans de Harry Potter, así que esto es genial. El pequeño Dobby se ve fabuloso y habla y es de muy buena calidad"
5.0,"No te puedes equivocar con productos genuinos de Harry Potter, y este juguete interactivo de Dobby no es la excepción. Como personaje muy querido, Dobby es adorado por los fans, lo que lo convierte en un regalo emocionante para cualquier entusiasta de Harry Potter. Al presionar su mano izquierda, Dobby se activa y habla tanto en inglés como en francés, una característica encantadora que puede ayudar a los niños a aprender idiomas. Dobby pronuncia frases de libros y películas y produce varios sonidos. Sus expresivos ojos parpadean cuando sus brazos se mueven, y sus orejas incluso se mueven. Tiene un toque dulce en el que reacciona cuando le dan un calcetín, gracias a un sensor que lleva en la mano. Si bien la voz puede sonar un poco débil, le añade encanto y hace reír. La opción de cambiar de idioma aumenta su versatilidad. El juguete funciona con 4 pilas AAA, ubicadas hábilmente en los pies. Aunque su precio era de 44,99€ (en el momento de escribir esta reseña), lo que a algunos les puede parecer un poco elevado, la calidad y el parecido con Dobby justifican el precio. Los artículos similares en el Mundo Mágico suelen ser mucho más caros. Si bien la voz puede no ser perfecta, las impecables expresiones faciales y movimientos lo compensan, ¡lo que convierte a este juguete de Dobby en una adición mágica a la colección de cualquier fan!"
5.0,"Si eres fan de Harry Potter y te gustó Dobby en la película, no te decepcionará este juguete. Creo que lo ha hecho bien, ya que se mantiene firme y firme mientras coge y mueve los brazos, las orejas y los ojos cada vez que dice una frase que se activa cogiendo su mano o colocando el calcetín sobre el sensor. Hay un interruptor en la parte trasera de Dobby donde puedes encender o apagar a Dobby y también puedes cambiar a Dobby para que hable inglés o francés, ya que realmente no hablo francés. Me pareció interesante escuchar a Dobby volver a decir las mismas frases en francés. No es necesario que apagues a Dobby, ya que si no interactúas con él, te pregunta «dónde estás» y si no respondes, te dice que tiene mucho sueño y se va a dormir. Creo que es un juguete interactivo de buena calidad y ha sido fascinante jugar con él, y creo que para un fan de Harry Potter sería un gran juguete de cumpleaños o Navidad."
5.0,"¡Este Dobby interactivo es un regalo perfecto para cualquier fan de Harry Potter!  La voz es realista en comparación con la película, por lo que se reconoce al instante.  Es fácil moverse con él e interactuar con él, ¡grandes y pequeños lo adorarán!"
5.0,"Dobby muy guapo. CONTIENE MÁS DE 30 SONIDOS Y FRASES. Cuando aprieta la mano de Magical Dobby, puede pronunciar algunas palabras mágicas con el movimiento de sus ojos, orejas, cabeza y brazos."
5.0,"Este mágico duende Dobby interactivo con calcetín hace un gran trabajo jugando con él, es para niños de 6 años o más. Tiene más de 30 sonidos y frases y mide 21,6 cm (8,5 pulgadas) de alto. A los niños les encanta que sus ojos, orejas, cabeza y brazos se muevan cuando interactúa con ellos. Dobby habla inglés o francés. Lo que incluye este paquete: 1) 1 Dobby mágico 2) 1 calcetín 3) 1 camisa 4) 1 hoja de instrucciones Me gusta mucho cómo reacciona este juguete ante sus calcetines, debo admitir que es muy bonito. Juguete de gran calidad para niños y su precio es muy razonable. Muy recomendable para cualquiera."
5.0,"Es una figura muy divertida y espeluznante; el movimiento es mejor que el de un juguete animatrónico típico. Tiene montones de frases y muchos idiomas diferentes que son muy divertidos de escuchar. También es divertido ver cómo interactúa con su calcetín. Está bien formado y pesa bien; aunque tiene que ser pesado en la parte superior, se mantiene en su lugar y no se cae. El material es suave, por lo que es muy cómodo de sujetar. Viene en una caja de presentación muy atractiva y sería un regalo ideal para un adicto al Dobby. Sin embargo, no querrás gastar tanto en él como un regalo casual, ya que sería una novedad cara."
5.0,"Mi hijo disfruta mucho de su pequeño Gobby. Es un fanático de Harry Potter, así que le encanta todo lo de las películas y este pequeño juguete no fue la excepción. Las pilas duran mucho tiempo en él y además interactúa rápidamente. Es un chico estupendo aquí."
5.0,"Hemos leído los libros y visto las películas más de las que podría contar. Nos encanta un poco de Potter y, por supuesto, esto también se refiere a Dobby. Cuando vi esto tuve que pedirlo. De hecho, solo llevamos un rato jugando con él, ya que está sentado en el lugar que le ha asignado entre los demás objetos coleccionables de mi hijo. Es increíblemente lindo con su pequeño calcetín. Sus dichos son claros y comprensibles, excepto cuando mi hijo cambió su idioma al francés. No tenía ni idea de lo que estaba diciendo entonces, ¡jajaja! Dobby funciona con pilas, pilas incluidas. Le quitamos las pilas antes de que las pusieran en la estantería y las reemplazaremos cuando vuelva a hablar con nosotros. Muñeca animada súper divertida para los fans."
5.0,"Tengo un rincón de lectura en mi biblioteca con temática de Harry Potter. Cuando vi a este pequeño Dobby, supe que tenía que tenerlo. Ha sido un gran éxito entre mis alumnos. Les encanta presionarle la mano y escucharlo decir diferentes frases, y a los más pequeños les encanta leerle cuentos a Dobby. Hemos realizado una actividad STEAM en la que los alumnos confeccionaron «ropa» para Dobby para darle libertad, y varios hicieron calcetines que cambiamos por los calcetines con los que venía él. Se ha convertido en la mascota no oficial de nuestra biblioteca, y estoy de acuerdo con eso. Este Dobby es perfecto para cualquier fan del universo de Harry Potter."
5.0,"Tengo 41 años y, sin embargo, esta muñeca Dobby se exhibe con orgullo en mi escritorio ahora. Es absolutamente adorable. Si bien tiene un aspecto ligeramente diferente al Dobby de las películas (este es más un aspecto infantil de Dobby), la voz suena casi exacta a la del Dobby de la película. Tiene varias frases diferentes (no las he contado, ya que muchas de ellas tienden a repetirse con más frecuencia que otras), pero no estoy seguro de que llegue a los 30 sonidos/frases que dicen. Sin embargo, son frases muy precisas (algunas se dicen realmente en la película y otras probablemente las diría Dobby en cualquier otro momento). Hay música que acompaña algunas de sus frases y abre y cierra los ojos mientras habla.  Si dejas de tocarle la mano durante un tiempo, te pregunta si sigues ahí. Luego, si sigues sin interactuar con él, te dice que tiene sueño y cierra los ojos. Súper lindo. Sin embargo, el sensor de calcetines es probablemente una de las cosas más inteligentes de este tío. Pon el calcetín en su mano y se alegrará.  Tiene la opción de hablar en francés o inglés, lo cual es bastante bueno."
5.0,"La muñeca elfa Dobby interactiva de Harry Potter de The Wizarding World ha sido un éxito absoluto como regalo de cumpleaños para mi sobrino de 12 años. Sus ojos se iluminaron de emoción al recibirla, y ha sido un placer ver su fascinación por las funciones interactivas. Con más de 30 sonidos y frases, es como tener un pedazo del mundo mágico en sus manos.  La atención al detalle en el diseño de la muñeca es impresionante y captura perfectamente el encanto y las peculiaridades de Dobby. Ha sido reconfortante verlo participar en juegos imaginativos y recrear sus momentos favoritos de Harry Potter.  En general, el muñeco elfo de Dobby ha aportado un toque de magia al mundo de mi sobrino. Es un juguete interactivo bien elaborado que, sin duda, se ha convertido en una preciada adición a su colección."
5.0,"¡Esto fue incluso mejor de lo previsto! Tiene varios dichos que son citas del libro. Si no se usa por un tiempo, cierra los ojos y su cabeza se inclina un poco para que parezca que está durmiendo.  ¿Hace mucho? ¡No!. ¿Me importa? ¡NO! ¡¡¡Es Dobby!!! Perfecto para CUALQUIER ventilador de HP"
5.0,"¡Este pequeño es tan lindo! Con alrededor de 9 pulgadas de altura, parece que nunca se queda sin cosas que decir mientras mueve la cabeza, los brazos, las orejas y los ojos cuando presionas su mano izquierda o le pones el calcetín en la mano derecha. Incluso toca un poco de música con sus palabras y, con el botón que lleva en la espalda, puedes seleccionar inglés u otro idioma, ¿creo que podría ser francés? He incluido un vídeo corto para que puedas ver cómo se mueve y escuchar cómo habla. Para un joven fan de este programa, ¡seguro que le encantará!"
5.0,"Es fantástico, sería un regalo increíble para los fanáticos y entretenimiento para los niños"
5.0,"Soy un gran fan de Harry Potter y tuve que comprar este Dobby en cuanto lo vi. Es absolutamente adorable en todos los sentidos. Me encantan sus ojos grandes, sus orejas caídas y que incluya su calcetín para sostenerlo. Es mucho más grande de lo que esperaba, lo cual fue una grata sorpresa. Es fácil jugar con él, basta con pulsar el botón de su mano y dice una variedad de frases. Su cabeza y sus ojos también se mueven. Si pones su calcetín en su otra mano, se emociona mucho, lo cual es muy lindo. Tengo mi Dobby exhibido en mi escritorio con orgullo junto con algunas de mis otras decoraciones de Harry Potter. Encaja perfectamente y adoro todo de él. Sería un regalo maravilloso para cualquier fan. En general, estoy satisfecho y lo recomendaría."
5.0,Este es un artículo imprescindible para los fans de Harry Potter. Funciona muy bien y es de muy buena calidad.
5.0,"El anuncio indica claramente el tamaño de este artículo, sin embargo, no lo noté. Me impresionó mucho el tamaño de este artículo y ahora el precio del artículo parece muy justo. Este es un juguete divertido y nostálgico para los amantes de Harry Potter, y las frases y todo eso, además de la mantita que sostiene, dan vida a su personaje favorito. A mis hijos les encantó y esperan poder coleccionar todos los diferentes juegos de esta línea de juguetes de Wizarding World."
5.0,¡¡¡¡¡¡¡¡¡¡¡¡¡¡¡¡¡¡¡¡¡¡¡¡¡¡¡¡¡¡¡¡¡¡¡¡¡¡¡¡¡¡¡¡¡¡¡¡¡¡¡ Esto es ideal para cualquier fan de Harry Potter y es muy divertido. Aprieta su mano y se va y me encanta el calcetín. Muy recomendable para todos los fanáticos de Potter
5.0,"¡Es un juguete muy lindo! Cobra vida cuando habla. La cabeza se mueve, las orejas se mueven hacia adelante, los ojos parpadean, etc. Tiene 35 frases diferentes. Sus expresiones son adorables. Estaba pensando en darle este pequeñín a uno de mis hijos o nietos. No creo que vaya a funcionar. Todos lo van a querer. ¡A quien reciba este increíble juguete interactivo le encantará!"
5.0,Esto es tan lindo. Puedo configurarlo para que hable francés o inglés. Me encantan todas las cosas que dice. Es súper lindo.
5.0,Este Dobby de Wizarding World es súper lindo. Soy fan de las películas de Harry Potter desde hace mucho tiempo. Siempre me ha gustado el personaje de Dobby. Esta muñeca interactiva de Dobby Elf es más grande de lo esperado y linda. Muy sencillo de activar la voz y los movimientos de Dobby. Ideal para un coleccionista como yo o un regalo para cualquier persona que ame el mundo de Harry Potter.
5.0,"¡Este es el juguetito más adorable! No esperaba que fuera tan lindo e interactivo. El idioma se puede cambiar entre inglés y francés. Sus orejas se mueven, su cabeza se mueve hacia arriba y hacia abajo, y parpadea. Se ve muy emocional y realista cuando habla. Estoy enamorada de este juguete. Él y mi bebé Yoda van a ser mejores amigos. Ja, ja."
5.0,Una de esas cosas que en cuanto la vi tenía que tenerla y me alegro de haberla conseguido. En persona tiene el mismo aspecto y ha sido un gran éxito en nuestra casa. Puede hablar inglés o francés y las pilas vienen con él.
5.0,El detalle es perfecto en dobby. Lo guardé en la caja para exhibirlo porque es perfecto. Los dichos que encuentra. Las orejas se mueven adorablemente y el pequeño calcetín. Esta es una bonita idea de regalo para un fan de Harry Potter.
5.0,"Dios mío, tu pequeño muggle se volverá loco por lo lindo que es este juguete Dobby: - Las bonitas características suavizadas y amigables lo hacen adorable - La cabeza y los pies proporcionales hacen que se ponga de pie fácilmente - ME ENCANTAN las frases y dichos - ¡Habla inglés y francés!     ¡Accio Dobby!"
5.0,Es tan lindo. ¿Cuánto tiempo les encantará y mantendrán su atención? No estoy seguro. Pero es bonito.
5.0,Tiene un aspecto perfecto. Muy probable que sea Dobby. Súper linda.
4.0,Todo bien pero sólo habla en inglés y francés.
4.0,"Este juguete es muy bonito, pero muy caro para lo que es. Si Dobby está en oferta a mitad de precio está bien. Lo recomiendo a los fanáticos de Harry Potter a los que les gusta coleccionar."
4.0,"Excelente producto, aunque la función de lenguaje de duelos puede molestar con el tiempo."
4.0,"Wizarding World Harry Potter, muñeca mágica interactiva de duendes Dobby con calcetín, más de 30 sonidos y frases, 21,6 cm, juguetes para niños a partir de 6 años Este regordete Dobby mide aproximadamente 8 1/2 pulgadas de altura y tiene una cabeza y pies grandes.  Agarra su pequeño calcetín con fuerza en una mano, lo cual es lindo. Está vestido al estilo tradicional de los elfos de una pieza de saco. Dobby necesita un total de 4 pilas AAA, ya que cada uno de sus pies requiere 2 pilas AAA. Las pilas vienen incluidas con el juguete y las mías ya estaban instaladas con el interruptor de alimentación encendido. Mi caja estaba ligeramente rota hacia los lados y el envoltorio de plástico estaba sellado con cinta adhesiva en varios lugares.  Dobby puede configurarse para que hable en francés o inglés mediante un interruptor en la espalda, por lo que esta función podría ser útil para los niños que intentan aprender un idioma diferente. Siempre ha sido uno de mis personajes favoritos de los libros y me encantaría verlo algún día en su propia historia.  Puede pronunciar algunas frases que también se dijeron en la serie de libros y películas y también hace varios sonidos. Cuando mueve sus brazos hacia arriba y hacia abajo, sus ojos grandes y tristes parpadean hacia ti. Incluso tiene orejas móviles. Tiene un sensor en la mano que reacciona cuando le dan un calcetín, lo cual es muy bonito. Presionar las manos le permite hablar e interactuar.  En general, es un bonito juguete interactivo y los fanáticos de Potter lo adorarán."
4.0,"Este es un adorable y divertido juguete interactivo para los fanáticos de Harry Potter.  El juguete habla inglés y francés; un interruptor en la espalda de Dobby permite al usuario elegir entre las dos opciones de idioma.  Dobby reacciona cuando le colocan el calcetín en la mano derecha (cuando un sensor está cubierto) agradeciendo al usuario que le haya regalado ropa.  Aprieta la mano izquierda de Dobby para hacerlo hablar. Dice una gran variedad de frases.  El audio es un poco pequeño/amortiguado, pero en general es aceptable.  Dobby parpadea y mueve la cabeza. Sus orejas son de silicona blanda.  El precio es bastante alto, aunque es un juguete interactivo de buena calidad y la mayoría de los posibles compradores probablemente estén de acuerdo en que vale la pena.  Sería un excelente regalo para los fanáticos de Harry Potter."
4.0,"¡Levanto la mano por no haber visto ninguna de las películas de Harry Potter! Me temo que no hace flotar mi barco, pero puedo entender cuánta gente se dedica a todo lo que tiene que ver con Harry Potter. Me temo que no sé muy bien quién es Dobby. Sin embargo, conozco a un par de jóvenes a los que les encanta todo lo relacionado con Harry Potter.  La figura interactiva de Dobby viene en una caja de venta al por menor con la parte delantera abierta. Ya hay cuatro pilas AAA instaladas, lo cual es genial. Esto significa que puedes probar la muñeca sin tener que sacarla de la caja.  La muñeca hace bastantes interacciones tanto con la voz como con el movimiento. Estas se desencadenan al tocar su mano o al entregarle un calcetín. La mejor parte, para mí, es la forma en que sus ojos saltones se mueven.  No sé si algún niño que no sea un gran fan de Potter descubrirá que el muñeco hace lo suficiente como para engancharlo durante un período de tiempo más largo. Esto lo convertiría en un error caro.  En general, un poco caro para lo que ofrece. Espero que eso ayude."
4.0,"Realmente no te puedes equivocar con productos genuinos de Harry Potter y esto no es de esperar. Dobby es un personaje muy querido, por lo que cualquier fan de Harry Potter estaría encantado de recibirlo.  Viene en una caja de la marca, por lo que es ideal para un regalo de cumpleaños o Navidad.  Presionas su mano izquierda y empieza a hablarte. Habla inglés y francés. Actualmente lo tengo hablando ambos idiomas para ayudar a mi sobrino a aprender francés.  Tiene un tamaño muy bueno, tiene un aspecto muy realista y se parece a las películas. A mi sobrino le emociona especialmente que su cabeza se mueva cuando habla. Además, la forma en que reacciona cuando tiras del calcetín también es ganadora en nuestra casa.  Requiere 4 pilas AAA y funciona a partir de los 6 años (sin embargo, mi sobrina de 3 años se ha escapado con esto varias veces).  Creo que su precio de 50 libras es un poco caro y estaría fuera del presupuesto de algunas personas. Esperemos que pronto tenga una pequeña oferta de precios en Amazon.  En general, perfecto para los amantes de los libros y las películas. Encantado de recomendarlo."
4.0,"Más grande de lo que había imaginado, y el altavoz es bastante alto y ligeramente amortiguado, sin embargo, sería un regalo genial para cualquier aficionado al alfarero. Me encanta que hable inglés y francés (en el vídeo sigue en modo demo), ya que actualmente estoy leyendo los libros en francés. Los materiales de alta calidad y los elementos interactivos fueron muy divertidos."
4.0,"Excelente Dobby interactivo, imprescindible para los fanáticos de Harry Potter, es muy divertido interactuar con él y a los niños también les encanta. Regalo perfecto para niños pequeños."
4.0,"Tenía muchas ganas de darle media estrella menos. No es un producto de cuatro estrellas, pero tampoco de tres, así que estoy siendo generoso. En primer lugar, el vídeo hace que suene como una especie de voz de audio de alta fidelidad y claramente no lo es. No lo digo solo yo, y estoy seguro de que podría haberse hecho mejor. La gama de movimientos, frases, etc. está bien, no hay problema, pero mi mayor queja, que puede parecer un poco extraña, es que la cara es demasiado bonita. Quizá querían asegurarse de que no asustara a los niños pequeños, pero yo esperaría algo con muchas más arrugas. Es como un Dobby bebé, y si fuera un gran fan de Harry Potter creo que me decepcionaría un poco. Así que, por un lado, sospecho que no va a satisfacerlos y, al mismo tiempo, no estoy seguro de que los niños muy pequeños vayan a sacar mucho provecho de esto, y acabará siendo uno de esos juguetes de «juega con él durante una hora el día de Navidad y luego olvídate de él cuando se acaben las pilas». ¡Lo siento!"
4.0,"Esta es una bonita figura de Dobby con buenos movimientos y efectos de sonido. Funciona con pilas, la configuración es sencilla y puedes hacer que la figura entre en acción a través de un botón o sensor. Muy divertido e incluso puedes elegir una opción de idioma entre inglés o francés. Un buen regalo para un fan de Harry Potter."
4.0,"Este es un juguete interactivo bastante bueno que mide 9 pulgadas de alto y ancho. Tiene un gran parecido con Dobby y una voz bastante buena, aunque es un poco delgada, todavía me hizo reír. Si lo desea, puede cambiar de idioma. Las pilas se encuentran en los pies (4 pilas AAA en total). El juego se activa mediante un sensor o un interruptor en cada mano. Para mí, un poco caro, con 50 libras, preferiría 40 libras, pero he visto cosas similares en el mundo de la cerámica por mucho más tiempo."
4.0,"Se trata de un muñeco elfo muy bonito, fantástico para los amantes de Happy Poter y también es una buena idea de regalo. El tamaño es bueno, un poco más grande de lo que esperaba y es súper adorable. El sonido es bueno y fuerte, con diferentes frases. Es lindo y muy divertido para los niños"
