Rate,Phrase
1.0,"Ventajas: -Excelente calidad de sonido con móvil/BT -Los colores bonitos son geniales (RGB) - La calidad del micrófono es increíble (me han dicho mientras usaba mi kraken «el micrófono me hacía sonar tranquilo», parecía que lo habían arreglado en el kaira pro)  Contras: - Cuando atiendes una llamada BT en una fiesta de Xbox, se desactiva el micrófono de chat hasta que restablezcas los auriculares, incluso después de finalizar la llamada. - La conexión inalámbrica no funciona con Xbox. Al azar, los auriculares comenzarán a romperse y luego se restablecerán. (Por lo general, durante episodios de alto volumen como abandonar aviones)  En resumen, ¿por qué diablos comprarías esto? He intentado cambiar los auriculares por uno nuevo, así que este es el segundo que he probado. Lo probé en varias generaciones de xboxes y Xbox, intenté actualizarlo a través de la PC y la consola, y pasé por el soporte técnico con Razr. Solo puedo esperar que el problema sea retirado de este producto antes de que empañe el nombre de Razr. Definitivamente me ha alejado de tener otro auricular inalámbrico Razr."
1.0,"Así que lo que más lamento de estos auriculares es el micrófono cada vez que estás en una fiesta de Xbox, la gente que está hablando oirá el eco de tus auriculares por lo baratos que están hechos. Los sonidos saldrán de los auriculares directamente al micrófono. Lo único bueno de los auriculares es la batería, la batería te durará todo el día con una sola carga. También obtienes una garantía de 2 años, así que no pasa nada. Pero no recomiendo comprarlos si vas a hablar con la gente. El audio del juego también es bueno, especialmente porque puedes cambiar la configuración. Puedes deshacerte del eco a través de la configuración, pero parece que siempre vuelven, además, la aplicación necesita una actualización, no parece que hayan trabajado duro en la aplicación de la navaja, solo un desastre. Aléjate"
1.0,"Nada más sacarlos de la caja, los conecté a la carga, dejé que terminaran y luego los probé. No tuve problemas para conectarme una vez que lo descubrí o con la aplicación, pero los auriculares simplemente tenían estática y no puedo ver los juegos en absoluto. Me jugué con la configuración para ver si podía arreglarlo sin éxito y ahora tengo que encontrar un nuevo auricular"
1.0,"Si pudiera darle estrellas negativas a este producto lo haría. NO COMPRAR! REPITO NO COMPRAR. Por 160 dólares este producto está construido extremadamente barato. Después de dos meses de uso, los auriculares auriculares agrietados en cada lado sólo colgando de los cables para hablar. Llegar al servicio al cliente es una pesadilla. Se disculparon y aconsejaron a pesar de que no fue mi culpa que no pueden reemplazar, pero me darán $10 dólares de mi próximo producto Razer. Es casi cómico.  Ahora vamos a llegar a la calidad de sonido real. Son sólidos cuando realmente funcionan. Dos problemas importantes son las distorsiones de conexión y sonido. La conexión se perdería aleatoriamente durante los juegos. La conexión también haría que mi controlador desincronizara tener que reiniciar todo el sistema. Distorsiones de sonido se producirían cada par de juegos haciendo que usted apague el auricular para arreglar. En ese punto es mejor que esperes que cuando se encienda no desincronizar. Por favor, ahorre su tiempo, dinero y frustración. Ve con otro par. Razer es una estafa. Ellos no respaldan sus propios productos."
1.0,"Recibí los auriculares hace poco. Estaba bien empaquetado e inmediatamente cargué los auriculares inalámbricos. Al principio, cuando lo conecté a mi xbox one, no podía obtener ningún audio. Fue entonces cuando me di cuenta de que se suponía que había una aplicación para estos auriculares en la xbox. Descargué la aplicación e intenté perder el tiempo con la configuración, con la esperanza de obtener algo de audio. Cuando abrí un juego aleatorio para probar dicho audio, sonaba como una estática lejana. No estoy seguro de cómo solucionar esto y tenía muchas ganas de ver los auriculares porque este es el tercer par de auriculares que he probado. Realmente me gustaría tener un par de auriculares que funcionen."
1.0,"No se trata solo de que este auricular no sea bueno, sino que es una experiencia negativa. Prefiero no usar auriculares y gritar por la televisión a mis compañeros de clan que lidiar con este pedazo de basura. Mi esposa ni siquiera necesita sus propios auriculares cuando jugamos juntos, porque todos los demás pueden escucharla clara como el día a través de este. El eco y la retroalimentación son irreales. Estoy bastante seguro de que cogería un pedo de pulgas si tuviéramos pulgas. Sin embargo, no te dejes engañar, a veces esto cambiará espontáneamente a mitad del juego y parece que estoy bajo el agua y cubriéndome la boca con una almohada. Literalmente, cada vez que juego con estos auriculares tengo que hacer una pausa en medio de algo y meterme con los ajustes al menos tres veces separadas. Los ajustes ni siquiera son consistentes; a veces el mismo grupo de ajustes hará que mi voz se salga de los auriculares y otras veces ni siquiera se dan cuenta de que estoy hablando. Es una atrocidad total. No desperdicies tu dinero."
1.0,"Los auriculares funcionaron de manera excelente con mi xbox series s durante 6 meses. Entonces, un día simplemente dejó de producir sonido. Lo traté muy bien y seguí los consejos en Internet para solucionarlo. Curiosamente, todavía se conecta a mi xbox pero no produce sonido. El micrófono sigue apareciendo para capturar el sonido. Cuando intento conectarlo a mi teléfono con bluetooth, se apaga. Estoy frustrado por haber pagado tanto por algo que no duraría medio año."
1.0,"Originalmente, cuando compré esto, tuve un extraño problema con el micrófono que ocurría cuando te salías del alcance y regresabas. El servicio de asistencia de Amazon no pudo ayudarme en absoluto y, de hecho, me envió uno nuevo porque no pudiste contactar con el fabricante. Parece ser un problema solo específico de este auricular, ya que mis amigos tienen otros y hacen lo mismo sin ningún problema. Han pasado un par de meses y mis amigos ni siquiera quieren unirse a una fiesta conmigo porque el micrófono capta cualquier movimiento. No puedes mover las gafas ni siquiera rascarte la cabeza. No hay forma de mejorar esta sensibilidad, así que acabo de comprar unos auriculares de un par de cientos de dólares sin ningún motivo. Decepcionado con esta empresa porque elegí este producto porque tuve una buena experiencia con su producto anterior en mi ps4"
1.0,"Emparejarlos apesta tener que desconectar el controlador de Xbox solo para asignar los auriculares cada vez que estés en la fiesta de Xbox, entonces todo está bien como la lluvia... no debería tener que ir a la aplicación asignar auriculares, desconectar el controlador, emparejar la consola y los auriculares solo para que funcionen. Un trabajo muy malo, Razer."
1.0,"El auricular no tenía un botón de emparejamiento y ese botón es necesario para conectarlo a mi Xbox, falta por completo, ¿no lo comprobé antes de enviarlo? Sé que se usan, pero no vi nada en que faltara un botón. Estoy muy decepcionado porque me gustan, pero no puedo permitirme un par nuevo, solo usado, y tenía muchas ganas de unos auriculares nuevos para jugar con mi amigo"
1.0,No funcionan. No los compres.  Entran y salen y se desconectan con frecuencia. No cometas el error de comprarlos.
1.0,"He usado el Razer Kaira para Xbox en mi Xbox Series X. He usado y sigo usando muchos productos Razer, como mandos, auriculares, ratones, etc. Ninguno me ha causado un dolor de cabeza como este. Los auriculares se desconectan constantemente por motivos que desconozco. Cuando los auriculares están puestos suena muy bien y, aunque la aplicación en Xbox es terrible y tiene muchos errores, sigue siendo manejable, pero cada vez que uso los auriculares se desconectan cada dos minutos. Sí, está cargado, sí, la actualización del firmware dice que está actualizado, sí, lo desconecté y lo emparejé de nuevo, pero sinceramente sigue siendo un dolor de cabeza."
1.0,"Funciona en su mayor parte. Tiene problemas importantes con el equilibrio del micrófono y el audio del juego. Por ejemplo, si quiero escuchar a mis compañeros de equipo, tengo que bajar el audio de los videojuegos. Si quiero escuchar el sonido del juego, tengo que bajar el volumen del chat.  Además, el audio se sigue cortando de forma bastante consistente. Con eso quiero decir, el audio se mezcla y, a veces, se corta por completo durante un minuto. Es como escuchar la emisora de radio, pero el dial simplemente no puede encontrar ese punto que permita escuchar con claridad. Como encontrar una emisora de radio, luego girar un poco a la derecha para que nunca quede completamente claro. He intentado restablecer y todas esas cosas buenas. El problema persiste. Este auricular no vale la pena. Periodo."
1.0,"5 estrellas para las funciones 1 estrella por cómo las realiza. Muchas funciones geniales pero no hace ninguna de ellas bien.  Los auriculares a menudo se cortan y se distorsionan cuando están en uso, a veces se desconectan todos juntos. (Estoy a 3 'de mi consola) El  micrófono es demasiado sensible, la gente terminará silenciándote.  Al usar Bluetooth, no hay forma de ajustar el sonido de forma independiente, por lo que si atiende una llamada mientras toca, solo escuchará un sonido distorsionado. Además, una vez que finalice la llamada, ya no podrá escuchar el chat del juego sin apagar y encender los auriculares.  Intercambié el primero debido a problemas con el micrófono y el sonido del altavoz roto.  Para mayor claridad, mi firmware está actualizado a partir del 29/12/21  En general, nunca recomendaría este auricular, ya que me ha causado mucha frustración y arruinado muchos juegos. La única razón por la que lo guardo es porque lo compré en oferta."
1.0,"Son absolutamente horribles. Son susceptibles a la interferencia de literalmente cualquier cosa, lo que hace que el audio se distorsione. Parece que está dejando caer paquetes. Razer se niega a reconocerlo. Ve a Reddit, este es un problema conocido. El audio entra y sale. Horrible."
1.0,"Compré esto y lo usé durante unos 5 minutos. Esta cosa tiene constantemente micrófonos calientes en Warzone y Xbox Party Chat. Pensando que era casualidad, llamé a Razer. Son absolutamente inútiles y me dijeron que lo devolviera a Amazon y comprara otra cosa. Luego descubrí en Reddit que MUCHAS personas tienen el mismo problema con estos auriculares. Mantente alejado, muy lejos. Razer también perdió un cliente por esto. Mi hijo es un streamer que usa productos Razer. Ahora mismo estoy buscando activamente productos para reemplazar los que usa Razer."
1.0,0 sonido envolvente sin precisión para determinar de qué dirección viene un enemigo en los juegos de fps. Solo escucha los pasos de los pies. Por más de 100 dólares esperaría algún tipo de precisión en el sonido.
1.0,"El sonido es bastante bueno, el micrófono es claro... pero NO FUNCIONA CON EL ADAPTADOR XBOX PC. Esta fue una característica muy importante para mí, así que solo le doy dos estrellas. Sí, he comprobado el adaptador para asegurarme de que funciona correctamente. El firmware se actualiza. Tampoco ajusta la mezcla de chat cuando está en el nuevo X/S. Auriculares súper buggy, pero cómodos. Evitaría comprar estos.  (Actualización - 13/09/2021): La atención al cliente de Razer es HORRIBLE. Siguen enviándote correos electrónicos pidiendo más información, solucionan poco problemas y están claramente interesados en frustrarte para que te des por vencido. Después de enviarles la misma información varias veces, finalmente me pidieron que filmara un video y lo publicara en YouTube. ¿DE VERDAD? Evitaré sus productos en el futuro solo por este motivo."
1.0,"Venía usada y sucia, a pesar de que elegimos la NUEVA opción. La parte verde de los auriculares era de color marrón porque alguien los llevaba puestos y la espuma que se ponía en las orejas estaba sucia. Tenía rasguños por todas partes. No contendría ningún cargo. Devolví y compré algo diferente."
1.0,Los auriculares dejaron de cargarse en menos de un año. RAZER se negará a reemplazarlos o repararlos en cualquier oportunidad.
1.0,"Hoy tengo mis auriculares. Me entusiasmó usarlos. Abrí la caja justo en los auriculares, una etiqueta que indica actualizarlos. No es gran cosa. Conectarlos a mi MAC no funciona. Aparentemente, Razer no logra mantenerse al día y solo hace que las actualizaciones estén disponibles para PC. Realmente no me importa si tu usuario de PC o MAC creo que ambos son geniales, pero cuando haces un producto que solo se puede actualizar a través de una fuente, es decepcionante y, en mi opinión, demuestra que una empresa, Razer en este caso, no logra mantenerse al día con sus competidores. Ojalá pudiera darle cero estrellas, ya que ni siquiera puedo usarlo. Un gran problema, me gusta mucho Razer y me entusiasmó usarlos."
1.0,Nada más que problemas después de aproximadamente un mes. Se apagó el micrófono. Se reemplazó el micrófono. El Bluetooth vinculado al audio de mi PC no funcionaba. Si tienen una pieza de repuesto para tus auriculares (micrófono de repuesto) deben ser una porquería. No me comprarían otro si me pagaran
1.0,"Hagas lo que hagas, no los compres. Se ven muy bien e incluso se sienten muy bien, pero la calidad del audio es un gran problema desde el primer momento. Al principio suenan magníficos, pero por la razón que sea, se cortan esporádicamente y hacen ruidos horribles que crujen, silban y zumban. Pensé que tenía un par defectuoso, pero el segundo par era igual. Lo busqué en Google y supuestamente es un problema con la conexión inalámbrica y el firmware actual. No ha habido ninguna actualización en más de 8 meses. Una vez más, son estéticamente agradables, livianos y cómodos, pero los problemas de audio son aborrecibles. No compre."
1.0,mala grieta plástica en la oreja izquierda Se rompió después de 5 meses de uso normal  Si vas a comprarlo... consíguelo en Best Buy con garantía
1.0,"El horrible sonido se rompe constantemente y solo lo he tenido durante una o dos semanas, esta no es la calidad de sonido que esperaba de unos auriculares que tienen un precio normal de 150 dólares, estoy un poco decepcionado y esperaba más de Razer. Estos son los peores auriculares que creo que he tenido. El sonido que se rompe y falla es tan fuerte que me duelen los oídos. Tengo que apagarlo y volver a encenderlo unas 20 veces por noche. No recomiendo estos auriculares a nadie."
1.0,"Los auriculares funcionaron muy bien hasta que dejaron de funcionar por completo, el audio se apaga y todo lo que puedo escuchar es un sonido ensordecedor. Hice todo lo que estaba en mi mano para solucionarlo y nada funcionó. Es mejor que te compres unos auriculares con cable porque no es la primera vez que tengo una mala experiencia con los auriculares bluetooth de Razors."
1.0,"Pedido uno, la luz de carga se apaga después de 15 minutos y no se carga por completo. Se deja durante la noche el 93% sin parpadeo de luz ni sólido. Reemplazado y exactamente lo mismo con la segunda unidad. Basura e imagina el impacto en el medio ambiente."
1.0,La batería no permanece cargada
1.0,"El audio está bien, pero entra y sale mucho. La peor parte es la sensibilidad del micrófono. El micrófono captará incluso la caída de alfileres más pequeña de la habitación. He estado en línea, he probado las soluciones en Reddit y YouTube. No funciona. Hay pocas cosas que desearía no haber comprado nunca. Este es uno de ellos.  Además, la aplicación de configuración de auriculares Razer para Xbox parece que alguien dedica todo su tiempo a hacer que la aplicación se vea genial. Lástima que no se haya dedicado tiempo a hacerlo funcional."
1.0,"Estos auriculares eran una basura hinchada que no solo captaba ruidos cuando giraba la cabeza, sino que mis amigos a veces sonaban borrosos, robóticos o distorsionados y se ponían molestos ASF. Las «luces» no son en absoluto necesarias y esta no era más que otra pieza de plástico sobrevalorada que se tiró directamente a la basura.  Compré UNOS AURICULARES INALÁMBRICOS OFICIALES DE XBOX por unos 80 dólares y NO he tenido PROBLEMAS Gracias MICROSOFT."
1.0,"Los auriculares se apagan todo el tiempo, se apagan y se vuelven a encender solos, el micrófono es muy sensible y capta todos los ruidos, aunque he comprado una funda para micrófono, no ayuda."
1.0,"Tuve que devolver los auriculares ya que se desconectaban y volvían a conectar. Es horrible con la PC pero funciona decentemente con Xbox, aunque también seguí escuchando desconexiones."
1.0,"Una vez que los empareje con su xbox, no podrá desvincularlos sin restablecer su xbox."
1.0,"Lo devolví después de un solo día. No me dejaba ajustar el volumen principal en la configuración de la xbox. Simplemente estaba atenuado. Además, no puedes actualizarlo si no tienes un PC, así que es una porquería. A mí me parece un gran defecto. Sé que la mayoría de la gente tiene un PC, pero no todo el mundo lo tiene, así que tal vez podrían hacer algo al respecto. Además de que el sonido no era lo suficientemente alto, eran muy cómodos en el oído. Me gustó el hecho de que el micrófono se puede desconectar si no es necesario. Pulgar hacia arriba si esto ayuda"
1.0,"La conexión inalámbrica con mi xbox eres muy mala, griche todo el tiempo o casi. Sin embargo, tengo entre tres y cuatro Xbox."
1.0,Se cae de la cabeza fácilmente. Los altavoces sonaron apagados
1.0,"Este es un auricular terrible. Cada 20 minutos recibo un molesto error de distorsión de audio de Xbox al usar mi Xbox Series X donde el audio se desliza durante unos 60 segundos a la vez. No he tenido este problema con los auriculares con cable. Esto puede ser más un error de Xbox que un error de Razer, pero es horrible. Otras personas están teniendo este problema y no hay respuesta pública de Razer al respecto. El micrófono también es extremadamente sensible y la sensibilidad no se puede ajustar. Además, no hay forma de usar los auriculares sin encender la Xbox, a menos que la Xbox esté desconectada, así que no lo compres si planeas usarlo en un PC o dispositivo Bluetooth sin que la Xbox esté encendida. No compre este auricular."
1.0,"Un par de días después de tener estos auriculares P.O.S, el audio comenzó a entrar y desaparecer y comenzó a emitir un extraño crujido. Cuando lo escuché por primera vez, me puse nerviosa y esperaba que fuera un número único, pero por supuesto, no fue así. El problema siguió y siguió hasta que finalmente dije que ya era suficiente y simplemente los devolví. NO COMPRES"
1.0,"No los he tenido desde hace ni un mes, este es mi segundo par, después de volver a comprarlos, me están dando problemas para escuchar a la gente en el chat de la fiesta, lo mismo pasó con mi primer par, la calidad del sonido es excelente y todos los comprados tienen problemas con el control de volumen y comienzan a estropear tu capacidad de escuchar otras personas en el chat se mantienen alejadas de este modelo o del modelo básico... nada bueno 😕"
1.0,"después de usarlos durante más de un mes, no valen la pena el dinero. regresaría, pero no quiero molestarse. No estoy seguro de si es una navaja o esa extraña conexión inalámbrica, pero no gastes tu dinero en esta."
1.0,"Aquí no podía charlar en absoluto, pedí 2 pares y me enviaron reemplazos de todos modos, pude escuchar el juego y yo mismo en los auriculares y sonó bien, no podía escuchar a otras personas sin importar lo que hiciera con todos los auriculares y vi en un foro que otras personas tenían el mismo problema y no parecen ser una solución para ello todavía, así que tuve que devolverlos todos, qué pena que tuvieran un buen sonido y fueran cómodos, pero ¿de qué sirve si no pueden cumplir su tarea principal de comunicarse con los demás en los juegos?"
1.0,"En el papel, este auricular se ve genial. En realidad, el auricular es un producto inacabado. Después de actualizar el firmware del auricular (lo que hay que hacer porque aparentemente el auricular no estaba terminado antes de venderlo a los consumidores), descubrimos que el auricular no funcionaba bien como un auricular. Era imposible oír a nadie hablar en ello. A través de la conexión Xbox, no podíamos escuchar a nadie hablar, y a través de Bluetooth, tuve que hablar muy alto para conseguir un volumen muy bajo grabado en la aplicación de memo de voz de mi teléfono. Me puse en contacto con el soporte técnico de Razer y dijeron que era un problema de Microsoft, y que no había solución para ello. (Lo cual es extraño, porque el problema también se presenta a través de Bluetooth)."
1.0,"Lamentablemente, la actuación fue mala. Crepitación estática."
1.0,"Tengo varios auriculares y esto desafortunadamente es un no ir. El micrófono es demasiado sensible. Es inutilizable. Si busca reddit, este es un problema continuo. Traté de jugar al COD y todos en mi grupo dijeron que podían oír todo en mi casa y cada aliento que tomaba. Tengo una maquinilla de afeitar cableada y es increíble. Este suena genial pero inutilizable. Intenté contactar con el soporte de razer, pero son inútiles e incluso sin idea sobre sus propios productos. Empiezan a culpar a todo en tu casa en vez de intentar ayudar. No compres un Kaira y no compres Razer si quieres un buen apoyo."
5.0,"Este juego lo compré porque soy fan de los Metroidvania, es una especie de Castlevania pero con chicas, son de la serie Gal Gun, tiene su nivel de dificultad ya que no pides salvar en donde haya save points, se salva al eliminar un jefe y solo encuentras unas jaulas que te..."
5.0,
5.0,"La verdad es que todavía no he jugado mucho a este juego, pero estoy contento con el precio y el envío ha sido rápido como siempre. Estoy deseando dedicarle más tiempo. Llegó nuevo y sellado en perfecto estado. Actualizaré esta reseña a medida que juegue más al juego, pero la compré principalmente como una adición a mi colección. Si lo compras como una adición a tu colección, ¡no hay nada mejor que él!"
5.0,El juego llegó a tiempo y en buena forma
5.0,Me encanta el concepto de juego en el que los personajes tienen diferentes habilidades y estilos de juego.
5.0,"Me encantan los gráficos, tiene elementos metroidvania, cambias entre dos de los personajes sobre la marcha, me recuerda a Portrait of Ruin Castlevania."
4.0,"El nuevo juego de Inti Creates no decepciona, siguiendo con una jugabilidad en 2D muy parecida a los juegos de Megaman Zero, que también desarrollaron ellos, ahora agregan mecánicas de un Metroidvania. Un juego bastante entretenido para fans del género acción/aventura..."
4.0,
4.0,Está bueno !! Esas waifus 10 de 10 y kurona🥵🥵
4.0,"Este juego tiene unos gráficos pixelados muy bonitos y unos controles modernos muy buenos, es una joya para los amantes de los videojuegos de la vieja escuela que merece la pena su precio."
5.0,"Lástima que tiene poca publicidad en el mercado porque es el mejor control de xbox que he comprado hasta el momento y llevo muchisimos años de Gamer. Cumple con todas las espectativas que requiere un control para uso competitivo, el tipo de agarre que tiene por..."
5.0,
5.0,"Me encanto, solo que el audio no lo levanta mucho o hasta ahora no e sabido como subirlo mas, recomiendo tener unos buenos cascos"
5.0,"Este control está increíble, cómodo,fácil de manejar y tienen muchos accesorios..  Lo recomiendo 100 💯💪💪💪"
5.0,Cumple con lo descrito en la jugabilidad es excelente lo único que no me ha gusto es que el material parce de mala calidad el plástico y después de unos meses se rompió un yostick peseo es b un en control pero mejor comprare el fusión pro 2 me gustó más y e jugado con los...
5.0,
5.0,"De verdad el stick perfecto, tanto en pc como en xbox, el diseño la presentacion las funciones, todo...¡¡¡"
5.0,Esta bueno
5.0,"Mucha personalización y comodidad, el delay no existe"
5.0,"Fácil de programar, simplemente increíble!"
5.0,"Es mi primera vez con un control de este tipo y es fabuloso, buen agarre, exelente respuesta, de las mejores compras que he hecho"
5.0,Esta suoer perfecto el control
5.0,El mejor mando de xbox para Rocket League
5.0,"Tengo unas 700 horas con este mando.  En ese tiempo, puedo describir desde el principio que este es, con diferencia, el mejor mando que he usado. Mucha gente lo comparará con el Gamesir G7 SE, que también he usado. Pero el Victrix Gambit es muy, muy superior. Es más rápido (unos 0,08 segundos), es más fluido, tiene un tacto más agradable, tiene una mejor personalización para las combinaciones de teclas, es más fácil de actualizar, etc. Los juegos a los que juego con este mando serían Tom Clancy's R6S, Fortnite, Battlefield, Dayz, Forza, Ghost Recon, Stray y muchos más. Aun así, sin perder el control, no hay problemas.  Si eres un jugador competitivo, ¡CONSIGUE ESTE MANDO! Si no, quizás busques una opción más económica, pero sigue siendo un gran mando."
