Rate,Phrase
1.0,"Tenía un par de ls15 viejos que me duraron 2 años, así que decidí cambiarme al ls50, el botón de encendido se rompió en 6 meses, se desconectó y me dijo que Bluetooth se desconecta cuando estaba usando el dongle, evitaba obtener el ls 15 menos problemas y cuesta mucho menos."
1.0,"Estos auriculares zumban constantemente mientras conversan en la fiesta, demasiado eco en el chat... Debido a la mala calidad, los graves son demasiado bajos, por lo que cuando el ecualizador ajusta el sonido, los auriculares zumban... Otras personas en el chat se quejaron de que estos auriculares zumbaban en sus oídos. No compre estos, siempre compré Tuttle Beach, pero quería probarlos para mi hijo en Navidad solo para que lo destriparan, ¡son inutilizables!"
1.0,"He probado numerosos auriculares de varias marcas. El mejor sonido que he obtenido es el de un Turtle Beach de gama media, pero eran endebles y se rompen fácilmente. Decidí probar dos modelos diferentes de LucidSound, junto con dos modelos de gama alta de otra compañía. Estos ganaron. Puede obtener una mejor calidad de sonido con el TB mencionado anteriormente, pero no demasiado. Son más cómodos, tienen un aspecto elegante, los controles están en lugares muy prácticos y parecen bastante resistentes.  Si estás buscando un audio nuevo, ¡pruébalo!  Actualización: Pasamos un año y medio y la batería se agotó. Han pasado 6 meses de garantía y el fabricante no venderá una batería de repuesto ni reparará los auriculares. Así que, un año y medio después de la compra, me quedo con unos auriculares rotos y una empresa que no va a respaldar su producto."
1.0,"¡Lo compré para mi novia para su cumpleaños y ni siquiera puedo hacer que funcione defectuoso, asf! Una sincronización horrible también hace un mejor sonido lúcido..."
1.0,"mi auricular vino como una caja abierta y previamente utilizado más cubierto en blanco seco especificaciones de suciedad la descripción declaró que estaba comprando una caja como nueva sin abrir con un poco de daño en la parte superior de la caja esto resultó en mí no recibir la parte más imprtante de un auricular inalámbrico la estación base usb un reemplazo en el sitio web de Lucids es de 50 dólares y eso me pondría sobre amazons nuevo precio no puedo encontrar una manera de ponerse en contacto con el servicio al cliente a través del sitio web para obtener mi contenido que falta a menudo he comprado los productos ligeramente dañados por un precio reducido, pero esto es un buen por qué no a 8 años de ningún problema borrar un registro de servicio impecable Pensé que este tipo de productos se vendieron a proveedores de terceros no reciclados por el almacén de Amazon"
1.0,Solicitud de devolución o reemplazo Aún no he recibido noticias del proveedor después de enviar la solicitud en su sitio web.
1.0,"Realmente me gustaría darle a este auricular cinco estrellas, pero cuando recibí el auricular pude decir que algo estaba muy mal con el sonido, luego intenté actualizarlos pero sentí que nunca se actualizó realmente. Entonces solo tuve más problemas con la calidad de sonido de conexión y la reproducción estática a través de los auriculares. Tratar de contactar con el servicio de atención al cliente fue una pesadilla, tardó sólo 2 meses en averiguar que tendría que PAGAR para enviar el producto defectuoso, en ese momento los devolví. Me encanta el concepto de este auricular y realmente me encantó el único día que conseguí que funcionara sin problemas. Pero la extrema falta de atención al cliente y atención al cliente lo arruinó."
1.0,"Compré este producto y, a los dos días de nosotros, la batería se agotó y, al intentar cargarla, nada estaba cargando los auriculares con todas las diferentes combinaciones de cables usb a micro usb. Si alguien ha tenido el mismo problema y sabe cómo solucionarlo, avíseme, pero hasta entonces mis auriculares todavía no funcionan o activar"
1.0,Se desconecta constantemente de la consola y no se puede volver a conectar después del primer uso. Terminé regresando.
1.0,"Ventajas:  1. Cómodo de llevar  Contras:  1. No cambia del modo bluetooth al modo de juego. 2. No sube el volumen 3. Solo reproducirá el volumen de uno de sus juegos o bluetooth  Para una empresa que afirma todas estas cosas en sus auriculares, nunca llegué a experimentarlas en su totalidad.  Francamente, por casi 200 dólares esperaba que funcionaran mínimamente. Ni siquiera funcionarían.  No pierdas tu tiempo ni tu dinero en estos. Apestan."
1.0,"Fue un buen comprador de auriculares, cuidado hecho por Power Una marca barata, lo tuve alrededor de 2 semanas apenas lo usé, fui a usarlo y presioné el botón de encendido y el plástico se rompió por dentro y el botón de encendido cayó dentro del auricular, lo que provocó que no se encendiera. Lo devolví y obtendré los profesionales de razer kaira"
1.0,"Si los usas alrededor de tu teléfono mientras juegas en un sistema, se desconectarán y dirán que están apagados. Cuando funcionan están bien pero una de las principales características es que dificulta este problema. Gasta tu dinero en un producto que realmente haga lo que dice."
1.0,"Si te gusta el hip hop pero todos a tu alrededor tienen mejor gusto, estos pueden ser geniales. Pero en realidad no son tan buenos para jugar. El sonido direccional es muy malo, así que si juegas juegos de FPS, los evitaría. Consigue unos auriculares para juegos con reputación de juego. Snoop Dogg no debe ser un gran jugador."
1.0,"Cuando lo recibo, claramente estaba dañado y abierto. Al mirar más a fondo, me di cuenta de que falta la bolsa que normalmente tienen los auriculares. Lo devuelvo porque obviamente alguien más lo ha comprado y le faltan artículos, de lo contrario podría haber sido un buen producto. :("
1.0,"Son basura pura y llanamente. Pedí un micrófono nuevo y eso no cambió nada, todos se quejan de la calidad del micrófono.  Tiene que haber unos auriculares en algún lugar de Walmart que sean mejores que estos y sean mucho más baratos.  Me estafaron."
1.0,Me vendió un auricular que no funcionaba
1.0,"La calidad del sonido no es muy buena, si juegas en línea con amigos, la calidad de tu voz es bastante mala. Usa un dongle, lo cual es ridículo porque el LS35 no tiene uno y la calidad de esos auriculares es mucho mejor. Evita estos auriculares."
1.0,"Una vez más, probé la basura total ls41 pierde conexión y el micrófono no se conecta a nada a través de cable o inalámbrico. Devuelva y compró el ls50 diseñado para Xbox One use. ¿Adivina qué? ¡Basura total! Salen de la conexión, no restablecen la conexión inalámbrica o cableada. Estos son el peor pedazo de basura caro que se vende al público porque creen que la gente no devolverá el artículo debido a la pereza. Devuelva esta basura y recupere su dinero. No compre este producto en absoluto!!!!!!!!!!"
1.0,"Estoy muy frustrado con estos auriculares. Excelente calidad de sonido, pero no puedo por la vida de mí conseguir las ruedas de control de volumen para funcionar en cualquiera de los modos. Envié el primer auricular de vuelta, ahora sigo teniendo el mismo problema con el segundo conjunto. Incluso descargué e instalé la actualización del firmware y seguí todas las instrucciones. Busqué un número de teléfono en su sitio web para obtener soporte, pero no pude encontrar uno."
1.0,"Dicen que son compatibles con Xbox, pero todavía tienes que tener un cable de audio conectado al mando si quieres charlar con otros jugadores y que te escuchen."
1.0,"Al principio están bien. Pero se desconectan sin ningún motivo después de un tiempo, incluso si están completamente cargados."
1.0,Constantemente cortado antes de recibir la actualización del software e incluso después de que se apagaba aleatoriamente después de unos 6 meses la batería de 20 horas era más como 4 horas y finalmente hoy se pateó el cubo lo saqué del cargador y lo enciendí conectado y luego inmediatamente apagado y no volverá a encender hablar sobre un desperdicio de dinero
1.0,"¡El micrófono es horrible! Suena como si tuvieras una almohada en la cara. Ingeniería descuidada, y claramente nadie de LucidSound o XBOX los ha utilizado porque si lo hubieran hecho se habrían dado cuenta de que el producto apesta. Es una vergüenza para XBOX por licenciar el uso de su nombre; claramente esto es todo un robo de dinero y no tiene nada que ver con asociarse con una empresa de tecnología de calidad."
1.0,"El Bluetooth no funciona correctamente, se congelará pase lo que pase si intentas usarlo y no puedes conectarte a la Xbox y al PC simultáneamente como se anuncia"
1.0,"Hago una buena cantidad de juegos, y puedo decirte por experiencia que te mantengáis alejados de estos. ¿Orejas? Basura. A bajo costo, todavía puede escuchar una cantidad decente de sonido fuera de los auriculares. ¿El boom? Terrible, amigos se quejaron de que mi voz sonaba extremadamente confuso y amortiguado. Los sonidos respiratorios extremadamente fuertes se recogen a cualquier distancia de su cara.  Elige cualquier otro auricular, pero no este."
1.0,"Estos auriculares son tan buggy. Se cortan solos, los botones dejan de funcionar, y cuando llamas cs te envían una actualización en un correo electrónico que no funciona. El servicio al cliente es terrible. Quieren que pagues para enviarles sus auriculares mientras tratan de encontrar lo que está mal. Sólo esperan que esperes. Ve a la playa de tortugas y serás más feliz."
1.0,"Sigue desactivando el uso y no se mantendrá conectado solo lo usó un 3-5 veces desde que lo compré y ya tengo problemas no realmente satisfechos con la calidad de la conexión No sé si esto es algo fixible a través de una actualización o qué, pero muy irritante para 200$ auricular"
1.0,Pobres en mi opinión No puedes vencer a Astro a50
1.0,"Este auricular funcionó muy bien durante todos los días 3 antes de que ya no pudiera conectarse a mi consola xbox, busqué en línea e intenté todas las formas de restablecer y restablecer las conexiones y nada funcionó."
1.0,"No voy a mentir, cuando compré estos eran geniales pero menos de 3 meses dejaron de trabajar, pude escuchar a mis amigos o no podía charlar. Sí, sé que esto es BS. Debería haber conseguido el Astros A50 nunca comprando estos Agian."
1.0,"Intenté ahorrar un poco de dinero y compré uno usado en Amazon y compré unos auriculares muy usados, sucios y rotos... No puedo creer que hayan vendido lo que tengo..."
1.0,"Los peores auriculares hicieron todo correcto y no solo no conectaba mi Xbox, y cuando lo hiciera, se desconectarían después de 5 minutos y los amigos que hablé también en 5 minutos dijeron que el micrófono era una basura absoluta, NO COMPRE ESTE AURICULAR."
1.0,El sonido envolvente no funciona sin mucho tiempo. Terminé teniendo que gastar 30 dólares para que funcionara. El plástico barato terminó rompiéndose en poco más de 12 meses.
1.0,"Dice que son Bluetooth, pero en realidad no se instalan fácilmente con Bluetooth y tampoco funcionan bien con iOS."
1.0,"Compré esta caja abierta y no funcionó y tampoco venía con un cable de carga. Si vas a conseguirlos, consíguelos nuevos"
1.0,"Compré 2 de estos en mayo de 2020, y mis hijos apenas los han usado. Soy que no son grandes jugadores. He creado un nuevo área de juego para Navidad y tratamos de usar estos. Ninguno de los pares funcionó en absoluto! Sé que son baratos, pero compre algo más que durará."
1.0,Auriculares def uno de los peores que he usado no importa lo que hice sonó horrible. Seguí todas sus instrucciones pero nada ayudó y la política de devolución de la compañía ha cambiado de 90 días a 30 días. Dicen que lo haga a Covid
1.0,"Fue una compra correcta hasta que la batería dejó de cargarse. Ni Amazon ni Lucid Sound me ayudarán a garantizarme el producto. Se supone que tiene una garantía de un año después de la compra, pero buena suerte haciéndolo. Mal servicio al cliente en ambas empresas."
1.0,Mi auricular con cable de 30 dólares tiene mejores altavoces y es menos complejo. No le dije a mi esposa nada elegante porque la fantasía no es diferente excepto el precio. ACTUALIZACIÓN: ni siquiera una semana más tarde el auricular QUIERE. No desperdicies tu dinero duramente ganado en esta basura glorificada
1.0,El micrófono capta todo el ruido de fondo. Lo usé para jugar.
1.0,¡El micrófono no funciona en absoluto! ¡Suena como si estuvieras en el fondo del océano! Es un problema conocido que varias personas han experimentado pero no lo han solucionado. Recomiendo llevar su negocio a alguien que realmente escucha a los clientes cuando se detectan defectos.
1.0,"El producto enviado por el vendedor era una unidad defectuosa. Se anunció como usado como nuevo, probado y funcionando. Definitivamente no funcionaba. No volveré a comprar usado."
1.0,1. No pude actualizar el firmware 2. El sonido era insatisfactorio para el precio 3. Nos sentimos mucho menos cómodos que la serie Steel 9x
1.0,Pedí este artículo en enero y ya está roto
1.0,"Pensé que los otros comentarios hicieron de esta compra algo seguro para un regalo de Navidad... supongo que no. Mi hijo adolescente estaba muy poco impresionado con la calidad del sonido y el rendimiento del micrófono, tanto así que volvió a usar los viejos auriculares de hace tres años. Ahora, estos se sientan en un estante, un fallido regalo de Navidad: - ("
1.0,"Lo recibí hoy sin llave. Me encantaría dar una mejor opinión, pero no puedo usarlos."
1.0,El número de soporte técnico va directamente al buzón de voz. No se acuse de recibo de ticket de soporte técnico enviado en línea. Lástima porque los auriculares parecen que serían muy agradables si realmente funcionaran.
1.0,El producto se rompió muy fácilmente. Sólo lo tenía por un mes y el cordón se rompió. Ahora no puedo recuperar mi dinero. La ventana de retorno cerró unos días antes de la ruptura. Estaba a la venta y ahora veo por qué.
1.0,"De acuerdo, si no planeas estar en el chat de grupo en ps5, de lo contrario, tu grupo escuchará zumbidos cuando hables. Me pareció molesto."
1.0,"la 'característica' donde puedes oírte hablar (monitoreo de micrófono) no funciona a menos que soplas en el micrófono o lo metes por la garganta. esa fue la ÚNICA razón por la que obtuve esto, así que 1/5."
1.0,
5.0,"Me gustaron mucho por que tienen una gran calidad de audio,además de que son inalámbricos,ya que el cable no te molesta,lo headsets anteriores que tenía usaban un conector Jack 3.5 mm y la verdad cuando estaba jugando el cable me..."
5.0,
5.0,"UPDATE AL FINAL--Me gustaron mucho este headset por que es cómodo, no se siente pesado, al inicio fue un poco laborioso comprender cómo se utilizan ya que antes utilizaba unos alambricos, por lo que primero realice la actualización del firmware que te pide, en mi caso lo..."
5.0,
5.0,Eh visto que todos se quejan de estos audífonos pero la verdad es que son excelentes su audio es increíble mas por las opciones de ecualización y el micrófono es parecido a los de asmr la verdad una excelente compra
5.0,"Con casi una semana de uso, la verdad me gustaron mucho. Tiene buena duración al rededor de 3 días con no se unas 3 a 4 hrs? Mas o menos. Se cargan en unas 3 hrs. La app que bajas de razer en el xbox es de mucha utilidad. El micrófono es muy bueno. Se actualizar de forma..."
5.0,
5.0,Son una muy buena opción para gamers y es muy accesible
5.0,"me funciona de maravilla en xbox series x, se escucha de lujo y se puede configurar todo desde el xbox, lo he conectado a PC y celular y sin problemas, todo de maravilla, la calidad de audio es superior comparado a otros que tengo mas sencillos de la misma marca e incluso..."
5.0,
5.0,"Explico mis quejas, 3 puntos 1. Considero poco útil el RGB que trae en los laterales, lo desactive desde que empecé a usarlos para obtener el máximo rendimiento de batería. 2. La caja y el modelo dicen que son para Xbox y para móvil, y mi experiencia de una semana..."
5.0,
5.0,"Realmente un producto de enorme calidad y fácil configuración, iba a irme por la opción de unos stealth 600 gen 2, pero creo que estos los superan en todos los aspectos.. conexión bluetooth en cualquier dispositivo y al mismo precio cuando estos en realidad superan en..."
5.0,
5.0,"Ase unos días compré este mismo producto pero reacondicionado a qui mismo en Amazon, pero me salió con un defecto en el botón de mute y lo regrese y este q es nuevo por lo pronto está perfecto y se escucha muy bien y más si tienes comprado dolby Atmos en Xbox mejora el..."
5.0,
5.0,Por el precio que tienen la calidad y funciones son excelentes
5.0,"Cambie los A20 de astro gaming por los Razer, cabe destacar que ya tenia unos V2 USB PC que me parecian de la mejor calidad por lo que decidí hacer la compra de los Kaira pro Wireless y la calidad de sonido es superior a cualquier comparación. La ventaja es la..."
5.0,
5.0,"Es 100% compatible con Xbox series X, se sincroniza bien, a veces tiene un ruido con el juego pero no es mucho tiempo y se vuelve a normalizar, El micrófono funciona bien, sin quejas"
5.0,"El Razer Kaira Pro son unos excelentes headsets, antes de comprarlos reviese muchos reviews y todos estaban de acuerdo que la calidad de los mismos, la comodidad y funcionalidad era excepcional y la verdad es que para nada quede desilucionado. El sonido es claro, nitido y..."
5.0,
5.0,"De uso continuo, presenta buena calidad, la batería sorprendió dura suficiente para una buena jornada de juegos de fin de semana."
5.0,"Magníficos, el sonido es muy bueno y envolvente aunque no tiene reducción de ruido, son muy cómodos para pasar una sesión larga de juego y la batería dura un día tranquilamente. Los cables tienen recubrimiento y no se romperán fácilmente. Me gusta el detalle de las luces en..."
5.0,
5.0,"Se escucha muy claro y fuerte el sonido. Si juegas en línea te escuchan y escuchas super claro. El precio sube y baja, así que aguanten hasta que llegue a los $2,000 o menos."
5.0,"El desempeño de este headset es increíble! Lo primer que hice fue bajar la app para configurarlo en mi Xbox Series S, bajó una actualización de firmware y la configuración me llevó un par de minutos; los perfiles predeterminados de audio son muy buenos y la mejora para el..."
5.0,
5.0,"Tienen un diseño muy bonito, que convina muy bien con el Series X. Fácil configuración con el Xbox, se vincula de manera casi inmediata. El sonido es muy bueno tanto de las bocinas como el audio del micrófono. Muy recomendables."
5.0,Había visto reseñas que eran buenas y la verdad son muy buenas excelente sonido y sobre todo por qué las agarre el oferta a mitad de precio
5.0,"1- Estéticamente están increíbles, pero lo mejor es la calidad de sonido que tienen con Dolby Atmos activado. Si no se cuenta con una suscripción a Dolby, la aplicación de Razer Headsets para consola Xbox resuelve el problema con el ecualizador. EL SONIDO ES INCREIBLE. 2-..."
5.0,
5.0,"La misma situación que muchos usuarios, son lo que prometen, audífonos buenos de calidad, personalizacion y ecualizador. Pero la problemática yace en el. BLUETOOTH, si quieres usarlos en tu celular, debes desconectar el xbox para evitar que se encienda cuando usas los..."
5.0,
5.0,"Son una maravilla en todos los sentidos. Buenos materiales, excelente audio y estética. El único pero que le pondría es que la parte de arriba es color verde claro, y sí vas a pasar mucho tiempo con ellos puestos, o vives en un lugar cálido, podrías mancharlos con el propio..."
5.0,
5.0,"Excelente condiciones de llegada, una manera de envolverte en lo juegos muy genial, lo único es su micro que se puede quitar, con el tiempo ese seguro será un problema, de ahí en fuera Excelentes audífonos"
5.0,"Me gustó mucho, aparte es compatible con cualquier dispositivo con Bluetooth, los probé con mi nintendo swich Lite y se escucha bien"
5.0,"Son una maravilla son mejor de lo que esperaba en todos los aspectos sonido, comodidad, duración de batería. Los compre antes de ver el anuncio de los headsets oficiales de xbox pero la verdad nada que envidiarle a esos además con la opción de emparejar el celular..."
5.0,
5.0,"Excelente producto, el sonido es genial, el que tenga su propia aplicacion para ecualizarlo ayuda mucho, ademas con dolby se escucha aun mejor, eso si, me pasa como a varios les a pasado, que de repente se escucha como si se hubieran cartoneado las bocinas, pero solo dura..."
5.0,
5.0,"Excelentes audífonos, muy cómodos, no te hacen sudar mucho y la calidad de sonido es de lo mejor que he probado, me gusta mucho el hecho de que el micrófono sea reemplazable y el rgb se ve muy bien"
5.0,"Muy buen sonido, fácil uso, se escucha muy bien la verdad.  Como todo no se quejen la batería no es eterna jejej pero si dura bien la carga"
5.0,"La verdad es un muy buen producto, el poder manejar el volumen del juego y el volumen del chat por separado, es muy bueno, y ademas el sonido es muy bueno y con mucha claridad."
5.0,Excelente audio lo unico que no me gusta que el microfono captura mucho hasta mi respiración y el mas mínimo movimiento pero si te alejas el micrófono se soluciona y ya no se escucha la respiración
5.0,"Me gusto la calidad de sonido, lo cómodos que son y lo fácil que se conectan"
5.0,"Se conecta muy fácil, solo te pide una actualización pero nada del otro mundo, muy buen audio"
5.0,"Excelente! Adaptado 100% para Xbox, sonido detallado, aunque no es el más fuerte diría yo, pienso que es suficiente y te permite apreciar los detalles aparte se que son muy cómodos."
5.0,"Muy buenos Headsets me llegaron hoy y me llegó antes de lo previsto Los recomiendo mucho tienen muy bien sonido , microfono y son muy cómodos 😎👍🏻"
5.0,"Excelentes audifonos, solo me gustaria que pudieras prenderlos sin que estos prendan en automático la consola de xbox series X para solo usarlos con mi celular"
5.0,"Compatible Xbox X series ,excelente sonido, batería dura varios días con uso moderado a intenso,diseño atractivo"
5.0,"Excelente opcion si no quieres cables, nota: no incluye control y la bateria dura mucho tiempo."
5.0,"Me encantaron, excelente calidad, exclente sonido para jugar juegos como APEX, 100% recomendables"
5.0,"Excelente audífonos , gran calidad de Audio , cómodos , larga duración de batería"
5.0,"Facil manejo, excelente calidad de audio"
5.0,Son los mejores audifonos
5.0,"100% recomendados, el audio impecable y para aquellos que son amantes de unos bajos fuertes esta es una gran elección, punto a resaltar es que tienen su aplicación dedicada para Xbox donde se pueden actualizar a su gusto."
5.0,"Me encantaron, si no los vas a usar con el XBOX, ni lo vincules, ya que es imposible des hacerlo después, y cada que prendas tus Kaira se encenderá tu XBOX (no han encontrado solución, RAZER culpa a XBOX y solo con una actualización por parte de microsoft se resolvería, así..."
5.0,
5.0,"Mis hijos encantados con este producto de gran calidad, fácil de cargar, ligeros, un sonido excelente, bluetooth, cero cables que se rompan o se enreden (todo eso me lo dicen ellos que son los expertos) así que vale la pena cada peso que pagué. Ah! y los obtuve con..."
5.0,
5.0,Muy buena opción de headset para xbox. Son muy cómodos y tienen gran sonido y batería. El poder usarlos con bluetooth es un plus y se ven muy bien con ese RGB. Estos y los Turtle Beach Stealth 700 gen 2 pueden ser las mejores opciones para xbox. Recomendables.
5.0,"Mi hija adoro estos audífonos, ergonómicos, prácticos, y con fidelidad asombrosa."
5.0,"El sonido que poseen estos Razer Kaira Pro es fantástico. Puedes ecualizar a tu gusto para lograr el sonido que mejor se adapte a lo que buscas. Tienen iluminación personalizable en ambos oídos del headset, el microfono trabaja de maravilla; en general: Una compra..."
5.0,
5.0,Lo que no me gusto del producto que des pues de tres meses de uso tiene mucha estatica deberían de a tualizar los audifonos
5.0,Buen producto muchas gracias
5.0,Muy buenas
5.0,Principalmente lo he utilizado en COD y me funciona Perfecto; ya no batallo con tirar el control al moverme y jalar el cable de los headsets anteriores que he tenido. Utilice aproximadamente semana y media de juego casual y aún no he tenido que volver a cargarlos. El RGB es...
5.0,
5.0,"Me encantó sus funciones de usarlo al xbox y al móvil al mismo tiempo, sus almohadillas son suaves y no calientan además de que lo puedes tener puesto por horas y no te van a doler las orejas, buena duración de batería y su diseño me gustó incluso sus luces RGB Lo..."
5.0,
5.0,"Me encantaron son muy cómodos se ajustan muy bien, uso lentes y no me molestaron, al momento de conectarlos al Xbox fue instantáneo no batalle nada, también los use al mismo tiempo en el celular para escuchar música y funciona de maravilla estoy muy feliz con la compra"
5.0,"Este es mi segundo par, desde que rompí mi original al sentarme sobre él: D Gran sonido y larga duración..."
